stories_id,publish_date,title,url,language,ap_syndicated,themes,media_id,media_name,media_url
"1708305149","2020-09-11 07:00:02","How to eat: guacamole","https://www.theguardian.com/food/2020/sep/11/how-to-eat-guacamole","en","False","","1751","Guardian US","https://www.theguardian.com/us"
"1708633269","2020-08-13 00:00:00","It's Time to Hire American | RealClearPolicy","https://www.realclearpolicy.com/articles/2020/08/13/its_time_to_hire_american_501792.html","en","False","","1040","RealClearPolitics","http://realclearpolitics.com/"
"1708873428","2020-08-24 00:00:00","Who gets asylum in the U.S.? Trump and 40 years of inequities stand in the way","https://www.latimes.com/california/story/2020-08-24/who-gets-asylum-trump-bias-disparities?fbclid=IwAR1TBKCTgvgkZcglyth39D8eAsuTK6x4rTl0xljJrDPLnRlzo8jVfnYqhMg","en","False","","6","LA Times","http://www.latimes.com/"
"1708881080","2020-06-23 01:39:39","H-1B: Trump administration extends visa ban to non-immigrants","https://www.mercurynews.com/2020/06/22/trump-administration-extends-visa-ban-to-non-immigrants/?utm_content=fb-mercurynews&utm_source=facebook.com&utm_medium=social&utm_campaign=socialflow","en","True","","35","San Jose Mercury News","http://www.mercurynews.com/"
"1709003061","2020-06-02 00:48:34","Business Lobbies Bombard Trump to Block Immigration Reforms","https://www.breitbart.com/economy/2020/06/01/business-lobbies-bombard-trump-to-block-immigration-reforms/","en","False","","19334","Breitbart","http://www.breitbart.com"
"1709006453","2020-08-03 11:10:26","'Tidal wave': States fear fiscal disaster as Congress slow-walks aid","https://www.politico.com/news/2020/08/03/states-fear-fiscal-disaster-congress-aid-390905","en","False","","18268","Politico","https://www.politico.com/"
"1710167575","2020-09-13 12:47:34","‘At the Intersection of Two Criminalized Identities’: Black and Non-Black Muslims Confront a Complicated Relationship With Policing and Anti-Blackness","https://time.com/5884176/islam-black-lives-matter-policing-muslims/","en","False","","4419","Time","http://time.com"
"1710808374","2020-09-14 01:00:00","Coronavirus, Trump Chill International Enrollment at U.S. Colleges","https://www.pewtrusts.org/en/research-and-analysis/blogs/stateline/2020/09/14/coronavirus-trump-chill-international-enrollment-at-us-colleges","en","False","","28467","Stateline - News about state government and politics from The Pew Center on the States","http://www.pewstates.org/projects/stateline"
"1712561176","2020-09-16 05:00:30","Greenport, N.Y.: A Casual Village on the Waterfront","https://www.nytimes.com/2020/09/16/realestate/greenport-long-island.html","en","False","","1","New York Times","http://nytimes.com"
"1713455484","2020-09-17 00:01:04","U.S. Is No Longer Land of Opportunity for Foreign MBA Students","https://www.bloomberg.com/news/articles/2020-09-17/best-business-schools-the-american-mba-is-losing-its-appeal-and-luster","en","False","","40944","Bloomberg","http://bloomberg.com"
"1715330577","2020-09-18 21:11:00","Ruth Bader Ginsburg died at 87 after serving as a Supreme Court Justice for 27 years. Here's a look at the trailblazer's life and career.","https://www.businessinsider.com/supreme-court-justice-ruth-bader-ginsburg-career-2018-8","en","False","","18710","Business Insider","http://www.businessinsider.com"
"1715363221","2020-09-18 09:37:12","How I came to the U.S. with $1,000 and built a net worth of $2.3 million","https://www.cnbc.com/2020/09/18/how-i-came-to-the-us-with-1000-and-built-a-net-worth-of-2-million.html","en","False","","1755","CNBC","http://www.cnbc.com/"
"1716261515","2020-09-20 06:05:00","Controversial online curriculum under scrutiny for Hawaii schools","https://www.staradvertiser.com/2020/09/20/hawaii-news/controversial-online-curriculum-under-scrutiny-for-hawaii-schools/","en","False","","39573","HonululuAdvertiser","http://www.staradvertiser.com/"
"1716587756","2020-06-23 15:30:53","Horowitz: Most serious surge in virus cases? Coming across the Mexican border - TheBlaze","https://www.theblaze.com/conservative-review/horowitz-serious-surge-virus-cases-coming-across-mexican-border","en","False","","22088","Blaze","http://www.theblaze.com"
"1717424593","2020-09-21 15:21:13","Amy Coney Barrett, a proven conservative on Trump's Supreme Court short list","http://rss.cnn.com/~r/rss/cnn_latest/~3/uiizXMWVKiA/index.html","en","False","","1095","CNN","http://www.cnn.com/"
"1717434027","2020-09-21 15:21:13","Amy Coney Barrett, a proven conservative on Trump's Supreme Court short list","http://rss.cnn.com/~r/rss/cnn_latest/~3/uiizXMWVKiA/index.html","en","False","","20088","CNN U.S. Edition","http://us.cnn.com"
"1718360435","2020-09-22 13:04:02","Donald Trump Gains Votes from Asian Immigrants","http://feedproxy.google.com/~r/breitbart/~3/9AIlwOaOUE8/","en","False","","19334","Breitbart","http://www.breitbart.com"
"1719299837","2020-09-23 12:10:55","Cal State gets its first chancellor of color: Fresno State president Joseph I. Castro","https://www.latimes.com/california/story/2020-09-23/new-chancellor-cal-state-system-of-480-000-students","en","False","","6","LA Times","http://www.latimes.com/"
"1720457114","2020-09-24 14:33:31","American bombs but not American books","https://theweek.com/speedreads/939457/american-bombs-but-not-american-books","en","False","","21542","The Week","http://theweek.com"
"1720496022","2020-09-24 16:20:00","Trump is proposing to limit student visas to two years for citizens of 59 countries","https://www.vox.com/policy-and-politics/2020/9/24/21454348/trump-student-visa-rule-vietnam-nigeria-iran","en","False","","103906","Re/code","http://recode.net"
"1720495828","2020-09-24 16:20:00","Trump is proposing to limit student visas to two years for citizens of 59 countries","https://www.vox.com/policy-and-politics/2020/9/24/21454348/trump-student-visa-rule-vietnam-nigeria-iran","en","False","","104828","Vox","http://www.vox.com"
"1720594708","2020-09-24 18:57:42","DHS Proposes Limiting Student Visa Length","https://www.newsmax.com/newsfront/homelandsecurity-student-visas-length/2020/09/24/id/988722","en","False","","25349","Newsmax","http://www.newsmax.com"
"1720599028","2020-09-24 19:27:52","Florida's Puerto Rican voters courted heavily by Republicans and Democrats","http://feeds.foxnews.com/~r/foxnews/politics/~3/1ix4du0Y6uc/florida-puerto-rican-voters-republicans-democrats-courting","en","False","","1092","Fox News","http://www.foxnews.com/"
"1721113597","2020-09-25 07:00:48","Individuals Can’t Heal The Climate When Capitalism Is The Virus","https://www.refinery29.com/en-us/2020/09/10029103/can-companies-individuals-stop-climate-change?utm_source=feed&utm_medium=rss","en","False","","104698","Refinery29","http://www.refinery29.com"
"1721510277","2020-09-25 16:37:36","Trump administration moves to limit student visa stays over fraud, national security concerns","https://www.foxnews.com/politics/trump-administration-limit-student-visa-stays","en","False","","1092","Fox News","http://www.foxnews.com/"
"1721647452","2020-09-25 21:08:54","Agency Officials Offer Surprise Giveaway to 400,000 Indian, Chinese White-Collar Visa Workers","http://feedproxy.google.com/~r/breitbart/~3/awRCh4Ml-w0/","en","False","","19334","Breitbart","http://www.breitbart.com"
"1722172313","2020-09-26 11:38:00","Blog Post: Expert: Proposed Student Visa Rule Sends ""Chilling Message""","https://www.lexisnexis.com/legalnewsroom/immigration/b/outsidenews/posts/expert-proposed-student-visa-rule-sends-chilling-message","en","False","","300354","LexisNexis® Legal Newsroom","http://www.lexisnexis.com/news/"
"1722184352","2020-09-26 08:55:36","Trump Chooses Far-Right Judge Barrett For Ginsburg Seat","https://www.nationalmemo.com/trump-chooses-far-right-judge-barrett-for-ginsburg-seat","en","False","","25363","National Memo","http://www.nationalmemo.com"
"1723058095","2020-09-28 00:17:11","New Immigration Rules Will Have Big Impact On International Students","https://www.forbes.com/sites/stuartanderson/2020/09/28/new-immigration-rules-will-have-big-impact-on-international-students/","en","False","","1104","Forbes","http://www.forbes.com/"
"1723358731","2020-09-28 08:01:59","Get ready for Trump's B-team to take over if he beats Biden. Here's who GOP insiders think will jump ship, and who might serve all 8 years","https://www.businessinsider.com/trump-turnover-cabinet-biden-agencies-transition-devos-ivanka-jared-2020-9","en","False","","18710","Business Insider","http://www.businessinsider.com"
"1724039160","2020-09-28 23:02:41","Trump Gets Pennsylvania Opportunity as Democrats Endorse H-1B Outsourcing","http://feedproxy.google.com/~r/breitbart/~3/pajpZIr1tCw/","en","False","","19334","Breitbart","http://www.breitbart.com"
"1724280830","2020-09-29 06:59:56","How To Move To Canada If Trump Gets Reelected.","https://www.forbes.com/sites/andyjsemotiuk/2020/09/29/how-to-move-to-canada-if-trump-gets-reelected/","en","False","","1104","Forbes","http://www.forbes.com/"
"1724311455","2020-09-29 07:19:14","Where Trump and Biden stand on 9 major policy issues","http://rss.cnn.com/~r/rss/cnn_latest/~3/spUP_vzLumE/index.html","en","False","","20088","CNN U.S. Edition","http://us.cnn.com"
"1724311206","2020-09-29 07:19:14","Where Trump and Biden stand on 9 major policy issues","http://rss.cnn.com/~r/rss/cnn_latest/~3/spUP_vzLumE/index.html","en","False","","1095","CNN","http://www.cnn.com/"
"1724662914","2020-09-29 13:57:49","Amy Coney Barrett Is Not A Feminist Icon","https://www.huffpost.com/entry/amy-coney-barrett-not-feminist-icon_n_5f7366e6c5b6f622a0c591ff","en","False","","27502","HuffPost","http://www.huffingtonpost.com/#"
"1724664103","2020-09-29 13:57:49","Amy Coney Barrett Is Not A Feminist Icon","https://www.huffpost.com/entry/amy-coney-barrett-not-feminist-icon_n_5f7366e6c5b6f622a0c591ff","en","False","politics and government, appointments and executive changes, women, biographical information","96720","HuffPost Latino Voices","http://voces.huffingtonpost.com/#spider"
"1724670139","2020-09-29 13:57:49","Amy Coney Barrett Is Not A Feminist Icon","https://www.huffpost.com/entry/amy-coney-barrett-not-feminist-icon_n_5f7366e6c5b6f622a0c591ff","en","False","politics and government, appointments and executive changes, women, biographical information","623375","Huffington Post - United States","http://www.huffingtonpost.com/?country=US"
"1725036833","2020-09-29 13:23:22","Despite pandemic, three LA college students pursue their dreams","https://www.csmonitor.com/USA/Society/2020/0929/Despite-pandemic-three-LA-college-students-pursue-their-dreams?icid=rss","en","False","","3","Christian Science Monitor","http://csmonitor.com"
"1725685340","2020-09-30 14:08:36","Why Donald Trump’s Former Housekeeper—and Millions of Other American Workers—Paid More in Federal Taxes Than Her Boss","https://time.com/5894381/tax-code-wealthy/","en","False","","4419","Time","http://time.com"
"1725773798","2020-09-30 15:44:19","Online learning during COVID-19: 8 ways universities can improve equity and access","https://theconversation.com/online-learning-during-covid-19-8-ways-universities-can-improve-equity-and-access-145286","en","False","education and schools, computers and the internet, colleges and universities","54346","Conversation","https://theconversation.com/us"
"1726817180","2020-10-01 14:53:33","Elections: 6 Scottsdale school board candidates talk reopening in pandemic and other hot topics","http://rssfeeds.azcentral.com/~/636200626/0/phoenix/local~Elections-Scottsdale-school-board-candidates-talk-reopening-in-pandemic-and-other-hot-topics/","en","False","education and schools, politics and government, elections","25128","AZCentral","http://www.azcentral.com"
"1727654604","2020-06-27 00:00:00","Group wants Cobb schools to address racism, bias in classroom","https://www.ajc.com/news/local-education/group-wants-cobb-schools-address-racism-bias-classroom/atupmw3rht0zdANv1sOGTJ/?fbclid=IwAR0QbYsN3yVOM4rfYjhmhP5SM1WegR1eGsamrSAo87qvU_n-qH2UZkClS6g","en","False","","22916","Atlanta Journal-Constitution","http://www.ajc.com"
"1728002995","2020-09-25 13:40:09","Everything Democrats Care About Is in Danger With Justice Amy Coney Barrett","https://www.thedailybeast.com/everything-democrats-care-about-is-in-danger-with-justice-amy-coney-barrett","en","False","politics and government, law and legislation, elections, decisions and verdicts, firearms","1707","Daily Beast","http://www.thedailybeast.com/"
"1728202979","2020-09-14 05:35:22","Foreign Workforce in U.S. Shrinks as Foreign Students Stay Away","https://www.breitbart.com/economy/2020/09/13/foreign-workforce-shrinks-foreign-students-stay-away/","en","False","","19334","Breitbart","http://www.breitbart.com"
"1728639830","2020-09-22 00:00:00","In Spanish, Cornyn ad says he ‘strongly supports legalization of Dreamers,' but immigrant advocates scoff","https://www.dallasnews.com/news/politics/2020/09/22/in-spanish-cornyn-ad-says-he-strongly-supports-legalization-of-dreamers-but-immigrant-advocates-scoff/?outputType=amp","en","False","","12","Dallas Morning News","http://www.dallasnews.com/"
"1730607237","2020-10-06 06:00:34","Trump's Student Visa Disaster","https://reason.com/2020/10/06/trumps-student-visa-disaster/","en","False","education and schools, computers and the internet, colleges and universities, immigration and refugees, crime and criminals, travel and vacations","72523","Reason.com","http://reason.com/"
"1730655257","2020-10-06 05:45:41","Yaa Gyasi’s Family Chronicle","https://www.thenation.com/article/culture/yaa-gyasi-transcendent-kingdom-review/","en","False","books and literature","1115","The Nation ","http://www.thenation.com/"
"1730704330","2020-10-06 07:32:36","My husband became a citizen at a heartbreaking time for America. Here's why I'm still celebrating","http://rss.cnn.com/~r/rss/cnn_latest/~3/TQT7rua-5C8/index.html","en","False","politics and government, united states politics and government, immigration and refugees, international relations","20088","CNN U.S. Edition","http://us.cnn.com"
"1730710671","2020-10-06 07:32:36","My husband became a citizen at a heartbreaking time for America. Here's why I'm still celebrating","http://rss.cnn.com/~r/rss/cnn_latest/~3/TQT7rua-5C8/index.html","en","False","politics and government, united states politics and government, immigration and refugees, international relations","1095","CNN","http://www.cnn.com/"
"1730811776","2020-10-06 08:30:00","How to fix America’s voter registration system so more people can vote","https://www.vox.com/21492380/elections-vote-register-same-day-automatic","en","False","politics and government","104828","Vox","http://www.vox.com"
"1730869189","2020-10-06 08:30:00","How to fix America’s voter registration system so more people can vote","https://www.vox.com/21492380/elections-vote-register-same-day-automatic","en","False","politics and government","103906","Re/code","http://recode.net"
"1730953498","2020-10-06 11:41:20.109766","Post-grad in 2020: How 3 women are navigating life without a safety net","https://www.washingtonpost.com/graphics/2020/the-lily/post-grad-in-2020/?utm_source=rss&utm_medium=referral&utm_campaign=wp_homepage","en","False","education and schools, medicine and health, labor, colleges and universities, women, unemployment, economic conditions and trends, research","2","Washington Post","http://washingtonpost.com"
"1731104118","2020-10-06 14:01:17","White House Posts H-1B Visa Reforms to Help American Graduates Get Good Jobs","http://feedproxy.google.com/~r/breitbart/~3/Xi1G6KwEm8E/","en","False","politics and government, labor, international trade and world market, wages and salaries","19334","Breitbart","http://www.breitbart.com"
"1731540375","2020-10-07 03:21:00","Trump Administration Issues Two New Rules To Restrict H-1B Visas","https://www.forbes.com/sites/stuartanderson/2020/10/07/trump-administration-issues-two-new-rules-to-restrict-h-1b-visas/","en","False","","1104","Forbes","http://www.forbes.com/"
"1731864295","2020-10-07 08:58:40","Against tough odds, Hispanic businesses are strengthening communities across America","https://www.cnbc.com/2020/10/06/how-hispanic-entrepreneurs-are-strengthening-their-communities-in-us.html","en","False","labor, hispanic-americans, immigration and refugees, food","1755","CNBC","http://www.cnbc.com/"
"1732125799","2020-10-07 13:32:09","Dear Sophie: Is it easier and faster to get an O-1A than an EB-1A?","https://techcrunch.com/2020/10/07/dear-sophie-is-it-easier-and-faster-to-get-an-o-1a-than-an-eb-1a/","en","False","computers and the internet, immigration and refugees","4438","TechCrunch","http://techcrunch.com"
"1732198577","2020-09-28 12:01:59","Trump-world insiders expect massive turnover if he wins a 2nd term - Business Insider","https://www.businessinsider.com/trump-turnover-cabinet-biden-agencies-transition-devos-ivanka-jared-2020-9?utm_source=facebook.com&utm_medium=social&utm_campaign=sf-bi-main","en","False","politics and government, united states politics and government, elections","18710","Business Insider","http://www.businessinsider.com"
"1732283600","2020-10-07 16:28:10","Amid Covid crisis, these Latino businesses are thriving","https://www.nbcnews.com/news/latino/amid-covid-crisis-these-latino-businesses-are-thriving-strengthening-their-n1242456","en","False","labor, hispanic-americans, immigration and refugees, economic conditions and trends, small business","34663","NBC Breaking News","http://www.breakingnews.com#spider"
"1732410730","2020-08-27 00:00:00","Prioritizing the Clean Up: 11 ‘Nasty’ Consequences of the Trump Presidency","https://m.dailykos.com/stories/2020/8/27/1972771/-Prioritizing-the-Clean-Up-11-Nasty-Consequences-of-the-Trump-Presidency?fbclid=IwAR0KH0iLe2axDXGwXMRbuO1tjuCSgcrtFI_AZfnbw9Qf3kUYkMtWnGsO62M","en","False","politics and government, finances, united states politics and government, elections, presidents and presidency (us), presidential elections (us), election issues, presidential election of 2004","115","Daily Kos","http://www.dailykos.com"
"1732428331","2020-10-07 19:03:03","Donald Trump Slashes Corporate Outsourcing to India's H-1B Gig-Workers","http://feedproxy.google.com/~r/breitbart/~3/F8VNavHrO_s/","en","False","labor, international trade and world market, wages and salaries","19334","Breitbart","http://www.breitbart.com"
"1732477352","2020-09-28 00:00:00","U.S. Rep. Haley Stevens faces Eric Esshaki in Michigan’s 11th Congressional District","https://www.mlive.com/public-interest/2020/09/us-rep-haley-stevens-faces-eric-esshaki-in-michigans-11th-congressional-district.html?utm_source=facebook&utm_medium=social&utm_campaign=kzoogazette_sf","en","False","","65422","mlive.com","http://mlive.com/"
"1733051962","2020-10-08 09:15:53","Tight race for San Jose’s District 4 seat could flip power on the council","https://www.eastbaytimes.com/2020/10/08/tight-race-for-san-joses-district-4-seat-could-flip-power-on-the-council/","en","False","politics and government, elections, labor, primaries, local government, city councils","27512","The Insider -","http://www.ibabuzz.com/insider/"
"1733066875","2020-10-08 07:23:52","The next US president won’t be great for H-1B visas, no matter who he is","https://qz.com/india/1914167/us-election-2020-donald-trump-joe-bidens-h-1b-visa-plans/","en","False","education and schools, politics and government, united states politics and government, elections, immigration and refugees","67264","Quartz","http://qz.com/#spider"
"1733089906","2020-10-08 09:15:53","Tight race for San Jose’s District 4 seat could flip power on the council","https://www.mercurynews.com/2020/10/08/tight-race-for-san-joses-district-4-seat-could-flip-power-on-the-council/","en","False","politics and government, elections, labor, primaries, local government, city councils","35","San Jose Mercury News","http://www.mercurynews.com/"
"1733261968","2020-10-08 05:30:00","H-1B Overhaul Pressures Outsourcing Firms and Their U.S. Clients","https://www.wsj.com/articles/h-1b-overhaul-pressures-outsourcing-firms-and-their-u-s-clients-11602149402?mod=pls_whats_news_us_business_f","en","False","labor, immigration and refugees, wages and salaries","1150","Wall Street Journal","https://www.wsj.com/"
"1733431226","2020-10-08 16:19:26","Trump, Pelosi, And McConnell Are All Failing Multiemployer Pensions - And The Rest Of Us","https://www.forbes.com/sites/ebauer/2020/10/08/trump-pelosi-and-mcconnell-are-all-failing-multiemployer-pensionsand-the-rest-of-us/","en","False","","1104","Forbes","http://www.forbes.com/"
"1735156041","2020-10-10 17:33:21","The swamp that Trump built","https://www.mercurynews.com/2020/10/10/the-swamp-that-trump-built/","en","False","politics and government, finances, united states politics and government, labor","35","San Jose Mercury News","http://www.mercurynews.com/"
"1735160026","2020-10-10 17:33:21","The swamp that Trump built","https://www.eastbaytimes.com/2020/10/10/the-swamp-that-trump-built/","en","False","politics and government, finances, united states politics and government, labor","27512","The Insider -","http://www.ibabuzz.com/insider/"
"1735166216","2020-10-10 17:23:48","The swamp that Trump built","https://www.seattletimes.com/nation-world/the-swamp-that-trump-built/?utm_source=RSS&utm_medium=Referral&utm_campaign=RSS_all","en","False","politics and government, finances, united states politics and government, labor","24940","Seattle Times","http://seattletimes.com"
"1735172376","2020-10-10 19:04:43","The swamp that Trump built: How the president reinvented D.C.'s culture of favor-seeking","https://www.startribune.com/the-swamp-that-trump-built-how-the-president-reinvented-d-c-s-culture-of-favor-seeking/572702721/","en","False","politics and government, finances, united states politics and government, labor","19","Star Tribune ","http://www.startribune.com/"
"1735718405","2020-10-11 06:05:00","Hawaii school board chief Catherine Payne urges dropping Acellus online curriculum","https://www.staradvertiser.com/2020/10/11/hawaii-news/hawaii-school-board-chief-urges-dropping-acellus-online-curriculum/","en","False","education and schools, tests and testing, medicine and health, diseases and conditions","39573","HonululuAdvertiser","http://www.staradvertiser.com/"
"1735921117","2020-10-11 19:05:55","H-1B Supporters Denounce Wage-Boosting Regulations","http://feedproxy.google.com/~r/breitbart/~3/4O2nCSvaNJ4/","en","False","politics and government, labor, immigration and refugees, demonstrations and riots, wages and salaries, economic conditions and trends","19334","Breitbart","http://www.breitbart.com"
"1736314041","2020-10-12 06:00:00","Latinos who are new U.S. citizens set to cast first vote for president","https://www.newsday.com/long-island/citizenship-voting-immigration-hispanic-heritage-month-1.50034434","en","False","politics and government, united states politics and government, elections, hispanic-americans, immigration and refugees, illegal aliens","13","Newsday","http://www.newsday.com/"
"1737048274","2020-09-15 12:43:00","UK’s new visa rules make it easier for international students to study and work now","https://www.businessinsider.in/education/news/uks-new-visa-rules-make-it-easier-for-international-students-to-study-and-work-now/articleshow/78127748.cms","en","False","education and schools, colleges and universities","18710","Business Insider","http://www.businessinsider.com"
"1737418495","2020-10-13 09:00:00","The Dangers of Cynical Sci-Fi Disaster Stories","https://slate.com/technology/2020/10/cory-docotorow-sci-fi-intuition-pumps.html?via=rss","en","False","medicine and health, gun control, firearms","19643","Slate.com","http://www.slate.com"
"1737605039","2020-10-12 13:52:24","The Far Right Holds a Grip on European Campuses","https://www.thenation.com/article/world/far-right-campus-europe/","en","False","politics and government, religion and churches, islam, women, immigration and refugees, illegal aliens, demonstrations and riots","1115","The Nation ","http://www.thenation.com/"
"1737854598","2020-10-13 17:42:00","IEEE-USA Welcomes New Rules For H-1B Visas; Further Changes Still Needed","https://www.thestreet.com/press-releases/ieee-usa-welcomes-new-rules-for-h-1b-visas-further-changes-still-needed-15458070","en","False","politics and government, law and legislation, labor, immigration and refugees, illegal aliens, wages and salaries","21619","The Street","http://www.thestreet.com"
"1738167395","2020-10-14 03:00:12","Why Parents in This High-Performing School District Chose All-Remote Learning","https://www.nytimes.com/2020/10/14/nyregion/nyc-coronavirus-schools-reopening.html","en","False","education and schools, medicine and health, diseases and conditions, vaccination and immunization","1","New York Times","http://nytimes.com"
"1739169872","2020-10-12 13:07:00","Blog Post: Killing the H-1B Visa Also Kills the US Economy","https://www.lexisnexis.com/legalnewsroom/immigration/b/outsidenews/posts/killing-the-h-1b-visa-also-kills-the-us-economy","en","False","labor, wages and salaries","300354","LexisNexis® Legal Newsroom","http://www.lexisnexis.com/news/"
"1739325084","2020-04-29 00:00:00","Trump’s Immigration Lockdown Will Weaken America","https://www.bloomberg.com/opinion/articles/2020-04-29/trump-coronavirus-immigration-lockdown-will-weaken-u-s-economy?cmpid=BBD042920_CUS&amp;utm_medium=email&amp;utm_source=newsletter&amp;utm_term=200429&amp;utm_campaign=closeamericas&amp;sref=VCq8VbSB","en","False","","40944","Bloomberg","http://bloomberg.com"
"1739426917","2020-03-24 17:28:43","Horowitz: With so many Americans hurting, Trump must cancel the H-1B visa lottery - TheBlaze","https://www.theblaze.com/conservative-review/horowitz-many-americans-hurting-trump-must-cancel-h-1b-visa-lottery","en","False","politics and government, finances, medicine and health, labor, economic conditions and trends","22088","Blaze","http://www.theblaze.com"
