stories_id,publish_date,title,url,language,ap_syndicated,themes,media_id,media_name,media_url
"1575896956","2020-02-20 00:00:00","Five Michigan Republicans jockey to take on Slotkin at pro-Trump candidate forum","https://www.mlive.com/public-interest/2020/02/five-michigan-republicans-jockey-to-take-on-slotkin-at-pro-trump-candidate-forum.html?utm_source=facebook&utm_medium=social&utm_campaign=flintjournal_sf","en","False","","65422","mlive.com","http://mlive.com/"
"1540334250","2020-02-04 15:56:48","State of the Union: Here's who lawmakers are bringing as guests","http://rss.cnn.com/~r/rss/cnn_latest/~3/yoQTVtAMfAM/index.html","en","False","","1095","CNN","http://www.cnn.com/"
"1505287913","2020-01-26 13:42:08","FBI reviewing claims Ilhan Omar married her brother","https://nypost.com/2020/01/26/fbi-reviewing-claims-ilhan-omar-married-her-brother/","en","False","","7","New York Post","http://www.nypost.com/"
"1535533869","2020-03-01 14:55:01","Judge rules Cuccinelli's appointment unlawful, voiding some orders","https://www.cbsnews.com/news/ken-cuccinelli-unlawfully-tapped-uscis-judge-voids-some-asylum-orders/","en","False","","1752","CBS News","http://www.cbsnews.com/"
"1536688659","2020-03-02 21:22:04","Our flawed health system isn't up to the challenge of the coronavirus","http://rss.cnn.com/~r/rss/cnn_latest/~3/eIc5YB3zFOc/index.html","en","False","","1095","CNN","http://www.cnn.com/"
"1536252066","2020-03-02 10:47:52.043531","Here's what Bernie Sanders' 'Medicare for All' proposal actually says","http://rss.cnn.com/~r/rss/cnn_topstories/~3/HjAlkjdWCV4/","en","False","","1095","CNN","http://www.cnn.com/"
"1567594974","2020-04-03 06:03:39","Women in ICE custody plead for release amid pandemic","https://www.cbsnews.com/news/coronavirus-women-ice-custody-louisiana-release-covid-19/","en","False","","1752","CBS News","http://www.cbsnews.com/"
"1576271503","2020-01-27 00:00:00","Immigration: Supreme Court lets Trump crack down on public assistance","https://www.usatoday.com/story/news/politics/2020/01/27/immigration-supreme-court-trump-crackdown-public-assistance/4588733002/?fbclid=IwAR20eyue8N4FpW73_ceV673W31BUFUlQPimMfVmpnCX0CoyrJAxdbvK3v6Y","en","False","","4","USA Today","http://www.usatoday.com"
"1547880812","2020-03-14 12:44:34","For Chinese, US visa halt puts jobs, citizen hopes at risk","https://www.washingtonpost.com/world/the_americas/for-chinese-us-visa-halt-puts-jobs-citizen-hopes-at-risk/2020/03/14/7ffd85ac-65ae-11ea-8a8e-5c5336b32760_story.html?utm_source=rss&utm_medium=referral&utm_campaign=wp_world","en","False","","2","Washington Post","http://washingtonpost.com"
"1531251974","2020-02-25 22:24:30","Sanders' ill-advised Cuba comments weren't wrong","http://rss.cnn.com/~r/rss/cnn_latest/~3/mMNMkQnHiis/index.html","en","False","","1095","CNN","http://www.cnn.com/"
"1506907152","2020-01-28 04:00:18","Why Wuhan Is at the Center of the Viral Outbreak","https://www.washingtonpost.com/business/why-wuhan-is-at-the-center-of-the-viral-outbreak/2020/01/22/ff61d700-3d7f-11ea-afe2-090eb37b60b1_story.html","en","False","","2","Washington Post","http://washingtonpost.com"
"1509836066","2020-01-30 03:41:08","Brexit Was Always a British Existential Crisis","https://www.theatlantic.com/international/archive/2020/01/britain-brexit-boris-johnson-influence-control/605734/?utm_source=feed","en","False","","1110","Atlantic","http://www.theatlantic.com/"
"1496038889","2020-01-15 11:19:32","Green Card Numbers Drop from 2016 to 2018","http://feedproxy.google.com/~r/breitbart/~3/McAmulq_VX8/","en","False","","19334","Breitbart","http://www.breitbart.com"
"1524397371","2020-02-18 11:28:43","In ‘Amnesty,’ an immigrant is put in an impossible position","https://www.washingtonpost.com/entertainment/books/in-amnesty-an-immigrant-is-put-in-an-impossible-position/2020/02/18/45105cdc-5256-11ea-929a-64efa7482a77_story.html","en","False","","2","Washington Post","http://washingtonpost.com"
"1497857406","2020-01-17 01:57:31","The Washington Post Editorial Board interviews 2020 candidate Andrew Yang","https://www.washingtonpost.com/opinions/2020/01/17/washington-post-editorial-board-interviews-2020-candidate-andrew-yang/","en","False","","2","Washington Post","http://washingtonpost.com"
"1577113325","","Read the full transcript of ABC News' 3rd Democratic debate - ABC News","https://abcnews.go.com/US/read-full-transcript-abc-news-3rd-democratic-debate/story?id=65587810&cid=social_fb_abcnp","en","False","","39000","ABC News","http://abcnews.go.com/"
"1521169777","2020-02-14 09:00:35","The Undocumented Agent","https://www.theatlantic.com/politics/archive/2020/02/a-former-border-agent-at-risk-of-deportation/606418/?utm_source=feed","en","False","","1110","Atlantic","http://www.theatlantic.com/"
"1507052545","2020-01-28 07:29:40","The Health 202: Trump can enforce his ‘public charge’ immigration crackdown -- for now","https://www.washingtonpost.com/politics/the-health-202-trump-can-enforce-his-public-charge-immigration-crackdown----for-now/2020/01/28/29d3cd2b-c997-4678-8da2-9212b717373b_story.html","en","False","","2","Washington Post","http://washingtonpost.com"
"1497136438","2020-01-16 20:50:00","Twitter, Microsoft, LinkedIn, and other companies are calling for an end to Trump’s rule to keep out low-income immigrants ","https://www.vox.com/2020/1/16/21069827/twitter-microsoft-linkedin-public-charge-trump-immigration-tech-companies","en","False","","104828","Vox","http://www.vox.com"
"1507138864","2020-01-28 08:30:00","Why the media is so polarized — and how it polarizes us","https://www.vox.com/2020/1/28/21077888/why-were-polarized-media-book-ezra-news","en","False","","104828","Vox","http://www.vox.com"
"1509016792","2020-01-29 09:40:00","How to talk someone out of bigotry","https://www.vox.com/2020/1/29/21065620/broockman-kalla-deep-canvassing","en","False","","104828","Vox","http://www.vox.com"
"1504717934","2020-01-25 09:00:17","Voting Rights Roundup: Proposed Ohio ballot measure would enact sweeping expansion of voting rights","http://www.dailykos.com/stories/1913822","en","False","","115","Daily Kos","http://www.dailykos.com"
"1572582840","2020-04-08 12:20:00","Democrats should making voting reform a nonnegotiable baseline for the next stimulus bill","https://www.vox.com/science-and-health/2020/4/8/21209306/election-2020-vote-by-mail-wisconsin","en","False","","104828","Vox","http://www.vox.com"
"1577523523","","New rules to deny green cards to many legal immigrants - ABC News","https://abcnews.go.com/Politics/wireStory/rules-deny-green-cards-immigrants-food-stamps-64923174?cid=clicksource_4380645_null_headlines_hed","en","False","","39000","ABC News","http://abcnews.go.com/"
"1562571877","2020-03-29 19:00:11","False promises for African basketball players","https://www.cbsnews.com/news/african-basketball-nba-ncaa-schemes-60-minutes-2020-03-29/","en","False","","1752","CBS News","http://www.cbsnews.com/"
"1502390262","2020-01-22 09:00:52","The U.S.-China tech dispute breeds suspicion in Silicon Valley","http://feeds.latimes.com/~r/latimes/business/~3/AuwHGDWNt7Y/china-tech-valley","en","False","","6","LA Times","http://www.latimes.com/"
"1491058582","2020-01-09 20:14:31","'They're looking for the remains, but they can't find anything': Iranian-Canadians reel after jet crash","https://www.latimes.com/world-nation/story/2020-01-09/canada-iran-ukraine-crash-victim-siavash-ghafouri-azar","en","False","","6","LA Times","http://www.latimes.com/"
"1510579578","2020-01-30 07:44:15","Trump’s anti-immigrant agenda isn’t about rule of law or economics at all","https://www.washingtonpost.com/opinions/trumps-anti-immigrant-agenda-isnt-about-rule-of-law-or-economics-at-all/2020/01/30/7a6b966a-43a8-11ea-b5fc-eefa848cde99_story.html","en","False","","2","Washington Post","http://washingtonpost.com"
"1488555861","2020-01-07 08:00:00","Trapped in while dining out: When white people make me part of their show","https://www.washingtonpost.com/lifestyle/food/trapped-in-while-dining-out-how-racism-often-makes-me-part-of-someone-elses-show/2020/01/06/4169c6d8-2c11-11ea-bcd4-24597950008f_story.html","en","False","","2","Washington Post","http://washingtonpost.com"
"1490415453","2020-01-09 06:00:47","Facebook won’t limit political ad targeting or stop false claims under new ad rules","https://www.washingtonpost.com/technology/2020/01/09/facebook-wont-limit-political-ad-targeting-or-stop-pols-lying/","en","False","","2","Washington Post","http://washingtonpost.com"
"1547373267","2020-03-13 08:30:00","Low-income immigrants are afraid to seek health care amid the Covid-19 pandemic","https://www.vox.com/identities/2020/3/13/21173897/coronavirus-low-income-immigrants","en","False","","104828","Vox","http://www.vox.com"
"1527001519","2020-02-20 07:29:53","The Trump administration’s green card Catch-22","https://www.washingtonpost.com/opinions/the-trump-administrations-green-card-catch-22/2020/02/20/a9175bfa-5426-11ea-929a-64efa7482a77_story.html","en","False","","2","Washington Post","http://washingtonpost.com"
"1577250971","2020-04-13 13:00:56","The importance of Apple and Google’s rare collaboration on contact tracing","https://www.engadget.com/apple-google-contact-tracing-explainer-170056298.html","en","False","","41231","engadget","http://www.engadget.com/"
"1577262910","2020-04-13 11:40:47","Hospitals are inundated. Some foreign-born health workers are blocked from helping.","https://www.seattletimes.com/nation-world/nation/hospitals-are-inundated-some-foreign-born-health-workers-are-blocked-from-helping/?utm_source=RSS&utm_medium=Referral&utm_campaign=RSS_all","en","False","","24940","Seattle Times","http://seattletimes.com"
"1577323018","2020-04-13 14:25:16","COVID-19 Has Left Me In Immigration Limbo","https://slate.com/news-and-politics/2020/04/coronavirus-diaries-green-card.html?via=rss","en","False","","19643","Slate.com","http://www.slate.com"
"1488897209","2020-01-07 14:33:37","GOP Senate candidate aims to beat Cory Booker in 2020: 'We are going to remove him from politics'","https://www.foxnews.com/politics/2020-cory-booker-senate-challenger","en","False","","1092","Fox News","http://www.foxnews.com/"
"1570415988","2020-04-06 11:47:44","Colleges are ditching letter grades this spring, but not all students are on board with ‘ungrading’","https://www.washingtonpost.com/education/2020/04/06/college-grading-coronavirus/?utm_source=rss&utm_medium=referral&utm_campaign=wp_national","en","False","","2","Washington Post","http://washingtonpost.com"
"1579646248","2020-04-15 23:52:32","New coronavirus tax deadlines, stimulus checks: Your questions answered","https://www.sfchronicle.com/business/article/Bay-Area-coronavirus-shutdown-here-s-where-to-15135505.php?utm_source=newsletter&utm_medium=email&utm_content=headlines&utm_campaign=sfc_morningfix&sid=5dbed0303f92a422ea51c9d5","en","False","","14","SF Chronicle","http://www.sfgate.com/"
"1509084536","2020-01-29 06:00:19","'I have lost everything': Iranian students with valid visas sent home upon arrival at U.S. airports","https://www.latimes.com/world-nation/story/2020-01-29/iranian-student-visas","en","False","","6","LA Times","http://www.latimes.com/"
"1515268143","2020-02-07 16:21:23","National Academies Chief: The U.S. Must End Reliance on Foreign Scientists","http://feedproxy.google.com/~r/breitbart/~3/UokBLvD14_I/","en","False","","19334","Breitbart","http://www.breitbart.com"
"1577792672","2020-04-14 06:11:27","The US has made post-graduation jobs impossible to get for many foreign students","https://qz.com/1835962/dhs-and-uscis-are-not-changing-opt-rules-for-foreign-students/","en","False","","67264","Quartz","http://qz.com/#spider"
"1513058410","2020-02-04 15:31:39","L.A. blocks private detention centers, including facilities for immigrant youth","https://www.latimes.com/california/story/2020-02-04/los-angeles-immigrant-detention-ordinance","en","False","","6","LA Times","http://www.latimes.com/"
"1503760898","2020-01-24 09:04:26","Iranian student whose deportation spurred Dem outcry has family ties to IRGC, Hezbollah: DHS official","https://www.foxnews.com/politics/iranian-student-whose-deportation-spurred-dem-outcry-has-family-ties-to-irgc-hezbollah-dhs-official","en","False","","1092","Fox News","http://www.foxnews.com/"
"1579138756","2020-04-15 13:37:37","Report: Coronavirus Blocking Foreign Graduates from Taking U.S. Jobs","http://feedproxy.google.com/~r/breitbart/~3/Tt120HeIJos/","en","False","","19334","Breitbart","http://www.breitbart.com"
"1579249112","2020-04-15 12:40:00","Why millions of college students and young adults won’t get a stimulus check","https://www.vox.com/the-goods/2020/4/15/21222170/stimulus-checks-dependents-excluded","en","False","","104828","Vox","http://www.vox.com"
"1580147257","2020-04-16 09:34:59","A COVID-19 Vaccine Will Not Be Enough — We Need a Plan to Distribute It","https://truthout.org/articles/a-covid-19-vaccine-will-not-be-enough-we-need-a-plan-to-distribute-it/","en","False","","22332","Truthout","http://www.truth-out.org"
"1580300493","2020-04-16 14:33:36","12 New Books We Recommend This Week","https://www.nytimes.com/2020/04/16/books/review/12-new-books-to-read-this-week.html","en","False","","1","New York Times","http://nytimes.com"
"1580484269","2020-04-16 18:15:50","What AOC Gets that Bernie Didn’t","https://www.politico.com/news/magazine/2020/04/16/sean-mcelwee-interview-aoc-sanders-191702","en","False","","18268","Politico","https://www.politico.com/"
"1500786676","2020-01-21 10:38:30","A Northeastern University student from Iran has been removed from the US. His attorney says he had a student visa","http://rss.cnn.com/~r/rss/cnn_latest/~3/3ipTIx29n0E/index.html","en","False","","1095","CNN","http://www.cnn.com/"
"1550220399","2020-03-16 09:21:06","Trump announced Google was building a virus screening tool. Then someone had to build it","https://www.washingtonpost.com/technology/2020/03/16/google-verily-coronavirus-website-trump/?utm_source=rss&utm_medium=referral&utm_campaign=wp_homepage","en","False","","2","Washington Post","http://washingtonpost.com"
"1554861105","2020-03-21 08:10:00","Here’s how you can help people who’ve lost jobs or housing in the wake of coronavirus","https://www.vox.com/2020/3/21/21187530/coronavirus-covid-19-donations-how-to-help-rent-assistance-food-banks","en","False","","104828","Vox","http://www.vox.com"
"1582020820","2020-04-18 09:30:00","H-1B workers can lose legal status along with jobs amid pandemic","https://www.seattletimes.com/business/h-1b-workers-lose-jobs-legal-status-amid-pandemic/?utm_source=RSS&utm_medium=Referral&utm_campaign=RSS_all","en","False","","24940","Seattle Times","http://seattletimes.com"
"1582514753","","Indian-Killer Andrew Jackson Deserves Top Spot on List of Worst US Presidents","https://indiancountrytoday.com/archive/indian-killer-andrew-jackson-deserves-top-spot-on-list-of-worst-us-presidents-q-Qg-O3lJUCE1bdhzyeS-A","en","False","","244743","Indian Country Today","http://indiancountrytoday.com/"
"1490670899","2020-01-09 11:17:27","The Daily 202: The ghosts of 1979 still haunt U.S. policy toward Iran and shadow Trump’s response to missile strikes","https://www.washingtonpost.com/politics/the-daily-202-the-ghosts-of-1979-still-haunt-us-policy-toward-iran-and-shadow-trumps-response-to-missile-strikes/2020/01/09/e69ab1be-22c5-4859-981b-5545a447d334_story.html","en","False","","2","Washington Post","http://washingtonpost.com"
"1530067190","2020-02-24 15:41:27","Trump’s rule creating a wealth test for immigrants is now in effect","https://www.vox.com/policy-and-politics/2019/10/11/20899253/trump-public-charge-rule-immigrants-welfare-benefits","en","False","","104828","Vox","http://www.vox.com"
"1582988644","2020-04-19 17:00:08","'We keep us safe': Black trans women on the frontlines of the pandemic","http://www.dailykos.com/stories/1938139","en","False","","115","Daily Kos","http://www.dailykos.com"
"1583648830","2020-04-20 00:58:21","Report: 450,000 Illegal Immigrants Are Getting College Degrees","http://feedproxy.google.com/~r/breitbart/~3/sPS73KRr3nU/","en","False","","19334","Breitbart","http://www.breitbart.com"
"1584693549","2020-04-21 06:18:49","Another CNN Source Shows Support for the Chinese Government in Order to Lash Out at the President","https://redstate.com/bradslager/2020/04/21/822658/","en","False","","128","RedState","http://www.redstate.com"
"1584897613","2020-04-21 14:20:00","Trump’s threat to end immigration to the US, explained","https://www.vox.com/policy-and-politics/2020/4/21/21229286/trump-immigration-ban-executive-order-coronavirus","en","False","","104828","Vox","http://www.vox.com"
"1584973973","2020-04-21 15:53:47","Explainer: Trump’s proposal to suspend legal immigration leaves many unanswered questions","https://www.reuters.com/article/us-health-coronavirus-usa-immigration-ex/explainer-trumps-proposal-to-suspend-legal-immigration-leaves-many-unanswered-questions-idUSKCN22330U?feedType=RSS&feedName=topNews","en","False","","4442","Reuters","http://www.reuters.com"
"1584981400","2020-04-21 15:53:47","Explainer: Trump’s proposal to suspend legal immigration leaves many unanswered questions","http://feeds.reuters.com/~r/Reuters/domesticNews/~3/UKg1SAcyds0/explainer-trumps-proposal-to-suspend-legal-immigration-leaves-many-unanswered-questions-idUSKCN22330U","en","False","","1089","Reuters ","http://www.reuters.com/"
"1585044667","2020-04-21 05:01:58","Trump says he will suspend immigration amid pandemic, leaving aides racing to make policy","https://www.washingtonpost.com/immigration/coronavirus-trump-suspend-immigration/2020/04/21/464e2440-838d-11ea-ae26-989cfce1c7c7_story.html?utm_source=rss&utm_medium=referral&utm_campaign=wp_homepage","en","False","","2","Washington Post","http://washingtonpost.com"
"1585076851","2020-04-21 17:56:51","Trump immigration ban to last up to 90 days, target those seeking permanent U.S. residency","http://feeds.reuters.com/~r/Reuters/worldNews/~3/nVIAT_d_Oa0/trump-immigration-ban-to-last-up-to-90-days-target-those-seeking-permanent-u-s-residency-idUSKCN2232VC","en","False","","1089","Reuters ","http://www.reuters.com/"
"1585082925","2020-04-21 17:56:51","Trump immigration ban to last up to 90 days, target those seeking permanent U.S. residency","https://www.reuters.com/article/us-health-coronavirus-trump-immigration/trump-immigration-ban-to-last-up-to-90-days-target-those-seeking-permanent-u-s-residency-idUSKCN2232VC?feedType=RSS&feedName=topNews","en","False","","4442","Reuters","http://www.reuters.com"
"1585087607","2020-04-21 17:55:30","Immigration Ban to Last Up to 90 Days, Target Those Seeking Permanent Residency","https://www.newsmax.com/us/ban/2020/04/21/id/964006","en","False","","25349","Newsmax","http://www.newsmax.com"
"1585117872","2020-04-21 19:10:50","New Immigration Limits Cause Anxiety in Families and Businesses","https://www.nytimes.com/2020/04/21/us/trump-immigration-ban-covid.html","en","False","","1","New York Times","http://nytimes.com"
"1585135500","2020-04-21 19:30:07","Trump immigration ban to last 60 days, target those seeking permanent residency","https://www.oann.com/trump-immigration-ban-to-last-60-days-target-those-seeking-permanent-residency/?utm_source=rss&utm_medium=rss&utm_campaign=trump-immigration-ban-to-last-60-days-target-those-seeking-permanent-residency","en","False","","127733","Oan","http://oann.com/"
"1585138829","2020-04-21 19:26:28","Immigration pause will last 60 days, Trump says","https://www.aol.com/article/news/2020/04/21/immigration-pause-will-last-60-days-trump-says/24061453/","en","False","","150985","AOL News","http://news.aol.com/"
"1585243359","2020-04-21 23:13:21","New friends Trump and Cuomo have a meeting of the minds","https://www.newsday.com/long-island/politics/trump-coronavirus-stimulus-cuomo-biden-hydroxychloroquine-1.44023652","en","False","","13","Newsday","http://www.newsday.com/"
"1585257092","2020-04-21 23:20:22","Trump’s latest move to limit immigration worries Seattle-area tech community","https://www.seattletimes.com/business/local-business/trumps-latest-move-to-limit-immigration-worries-seattle-area-tech-community/?utm_source=RSS&utm_medium=Referral&utm_campaign=RSS_all","en","False","","24940","Seattle Times","http://seattletimes.com"
"1585496253","2020-04-21 20:00:00","Piercing Illusion of Trump's 'Immigration Ban'","https://www.realclearpolitics.com/articles/2020/04/22/piercing_illusion_of_trumps_immigration_ban_143007.html","en","False","","1040","RealClearPolitics","http://realclearpolitics.com/"
"1585509216","2020-04-22 05:30:02","Trump's vow to suspend immigration over coronavirus has certain industries on edge","http://rssfeeds.azcentral.com/~/622135566/0/phoenix/nation~Trumps-vow-to-suspend-immigration-over-coronavirus-has-certain-industries-on-edge/","en","False","","25128","AZCentral","http://www.azcentral.com"
"1585552713","2020-04-22 06:26:28","Coronavirus Live Updates: Clues Emerge on Virus’s Path; Trump Orders Halt on Green Cards","https://www.nytimes.com/2020/04/22/us/coronavirus-updates.html","en","False","","1","New York Times","http://nytimes.com"
"1585552755","2020-04-22 06:21:22","Coronavirus live updates: Senate reaches $484B stimulus deal; Georgia's reopening gets mixed reviews; Trump halts green cards 60 days","http://rssfeeds.azcentral.com/~/622137334/0/phoenix/nation~Coronavirus-live-updates-Senate-reaches-B-stimulus-deal-Georgias-reopening-gets-mixed-reviews-Trump-halts-green-cards-days/","en","False","","25128","AZCentral","http://www.azcentral.com"
"1585579034","2020-04-22 06:52:29","Trump's vow to suspend immigration over coronavirus has certain industries on edge","http://rssfeeds.usatoday.com/~/622135566/0/usatoday-newstopstories~Trumps-vow-to-suspend-immigration-over-coronavirus-has-certain-industries-on-edge/","en","False","","4","USA Today","http://www.usatoday.com"
"1585579005","2020-04-22 06:21:22","Coronavirus live updates: Senate reaches $484B stimulus deal; Georgia's reopening gets mixed reviews; Trump halts green cards 60 days","http://rssfeeds.usatoday.com/~/622137334/0/usatoday-newstopstories~Coronavirus-live-updates-Senate-reaches-B-stimulus-deal-Georgias-reopening-gets-mixed-reviews-Trump-halts-green-cards-days/","en","False","","4","USA Today","http://www.usatoday.com"
"1585650391","2020-04-22 08:00:00","The Pandemic’s Cost to Privacy","https://www.theatlantic.com/politics/archive/2020/04/coronavirus-pandemic-privacy-civil-liberties-911/609172/?utm_source=feed","en","False","","1110","Atlantic","http://www.theatlantic.com/"
"1585755167","2020-04-22 09:57:51","Coronavirus daily news updates, April 22: What to know today about COVID-19 in the Seattle area, Washington state and the nation","https://www.seattletimes.com/seattle-news/health/coronavirus-daily-news-updates-april-22-what-to-know-today-about-covid-19-in-the-seattle-area-washington-state-and-the-nation/?utm_source=RSS&utm_medium=Referral&utm_campaign=RSS_all","en","False","","24940","Seattle Times","http://seattletimes.com"
"1585807693","2020-04-22 10:56:19","For Indian Diaspora, Panic and Anger Over Trump’s Immigration Plans","https://www.nytimes.com/2020/04/22/world/asia/india-immigration-trump-coronavirus.html","en","False","","1","New York Times","http://nytimes.com"
"1585807805","2020-04-22 10:48:57","The Daily 202: Shifting coronavirus timeline shows how much experts still don’t know – and why testing matters","https://www.washingtonpost.com/politics/the-daily-202-shifting-coronavirus-timeline-shows-how-much-experts-still-dont-know--and-why-testing-matters/2020/04/22/a64fa974-33e1-4a3a-acab-06ca90f8df78_story.html?utm_source=rss&utm_medium=referral&utm_campaign=wp_homepage","en","False","","2","Washington Post","http://washingtonpost.com"
"1585833790","2020-04-22 11:15:00","London Firm Launches ""Plan B"" Podcast On Intelligent Citizenship Solutions","https://www.thestreet.com/press-releases/london-firm-launches-quot-plan-b-quot-podcast-on-intelligent-citizenship-solutions-15300495","en","False","","21619","The Street","http://www.thestreet.com"
"1585916673","2020-04-22 11:48:56","Trump's vow to suspend immigration over coronavirus has certain industries on edge","https://www.norwichbulletin.com/zz/news/20200422/trumps-vow-to-suspend-immigration-over-coronavirus-has-certain-industries-on-edge?rssfeed=true","en","False","","74242","norwichbulletin.com","http://www.norwichbulletin.com/#spider"
"1585954571","2020-04-22 11:48:56","Trump's vow to suspend immigration over coronavirus has certain industries on edge","https://www.fayobserver.com/zz/news/20200422/trumps-vow-to-suspend-immigration-over-coronavirus-has-certain-industries-on-edge?rssfeed=true","en","False","","71280","fayobserver.com","http://fayobserver.com/#spider"
"1585957464","2020-04-22 11:48:56","Trump's vow to suspend immigration over coronavirus has certain industries on edge","https://www.dispatch.com/zz/news/20200422/trumps-vow-to-suspend-immigration-over-coronavirus-has-certain-industries-on-edge?rssfeed=true","en","False","","41","Columbus Dispatch","http://www.dispatch.com/"
"1586045967","2020-04-22 14:47:46","Trump To Curb Immigration, As Anti-lockdown Protests Simmer","https://www.ibtimes.com/trump-curb-immigration-anti-lockdown-protests-simmer-2963103?utm_source=Public&utm_medium=Feed&utm_campaign=Distribution","en","False","","41550","IBTimes","http://www.ibtimes.com/"
"1586047681","2020-04-22 15:06:59","Trump’s Temporary Freeze on Green Cards","https://www.nytimes.com/2020/04/22/opinion/letters/coronavirus-trump-immigration.html","en","False","","1","New York Times","http://nytimes.com"
"1586079167","2020-04-22 15:41:00","Editorial Roundup: US","https://abcnews.go.com/US/wireStory/editorial-roundup-us-70293167","en","False","","39000","ABC News","http://abcnews.go.com/"
