stories_id,publish_date,title,url,language,ap_syndicated,themes,media_id,media_name,media_url
"1635866082","2020-06-15 20:23:32","More College Student Groups Urge Trump to Halt H-1B, OPT Visas","http://feedproxy.google.com/~r/breitbart/~3/8vDG28qsIF0/","en","False","","19334","Breitbart","http://www.breitbart.com"
"1635880583","2020-06-16 01:10:05","Businesses, colleges plead with Trump to preserve work visas","https://www.startribune.com/businesses-colleges-plead-with-trump-to-preserve-work-visas/571283582/","en","False","","19","Star Tribune ","http://www.startribune.com/"
"1635882711","2020-06-16 01:06:48","Businesses, colleges plead with Trump to preserve work visas","https://www.sfgate.com/news/article/Businesses-colleges-plead-with-Trump-to-preserve-15342592.php","en","True","","14","SF Chronicle","http://www.sfgate.com/"
"1635928291","2020-06-16 01:33:49","Businesses, colleges plead with Trump to preserve work visas","https://abcnews.go.com/Business/wireStory/businesses-colleges-plead-trump-preserve-work-visas-71269365","en","False","","39000","ABC News","http://abcnews.go.com/"
"1635968594","2020-06-16 01:33:35","Businesses, colleges plead with Trump to preserve work visas","https://www.newsday.com/business/businesses-colleges-plead-with-trump-to-preserve-work-visas-1.45779427","en","True","","13","Newsday","http://www.newsday.com/"
"1635988437","2020-06-17 00:53:04","Businesses, colleges plead with Trump to preserve work visas","https://www.dispatch.com/ZZ/news/20200616/businesses-colleges-plead-with-trump-to-preserve-work-visas?rssfeed=true","en","True","","41","Columbus Dispatch","http://www.dispatch.com/"
"1636012104","2020-06-17 00:53:04","Businesses, colleges plead with Trump to preserve work visas","https://www.norwichbulletin.com/ZZ/news/20200616/businesses-colleges-plead-with-trump-to-preserve-work-visas?rssfeed=true","en","True","","74242","norwichbulletin.com","http://www.norwichbulletin.com/#spider"
"1636222710","2020-06-16 01:58:28","India's NASSCOM Companies Ask Trump to Keep the H-1B Pipeline","http://feedproxy.google.com/~r/breitbart/~3/89-r6ItSFwQ/","en","False","","19334","Breitbart","http://www.breitbart.com"
"1636775523","2020-06-16 17:49:55","Georgia GOP Urges for Full Immigration Moratorium with Millions Jobless","http://feedproxy.google.com/~r/breitbart/~3/KiJ0mbaJDMI/","en","False","","19334","Breitbart","http://www.breitbart.com"
"1637537435","2020-06-17 12:55:00","Will visa restrictions last? Foreign workers, students hope not.","https://www.csmonitor.com/USA/Foreign-Policy/2020/0617/Will-visa-restrictions-last-Foreign-workers-students-hope-not?icid=rss","en","False","","3","Christian Science Monitor","http://csmonitor.com"
"1638147550","2020-06-18 06:00:47","The Trump administration is moving to restrict international students. Why that’s a bad idea.","https://www.washingtonpost.com/education/2020/06/18/trump-administration-is-moving-restrict-international-students-why-thats-bad-idea/","en","False","","2","Washington Post","http://washingtonpost.com"
"1638426224","2020-06-18 10:09:34","The Supreme Court just ruled to preserve protections for hundreds of thousands of young immigrants for now","https://www.vox.com/2020/6/18/21249594/daca-supreme-court-trump-dreamers-ruling","en","False","","104828","Vox","http://www.vox.com"
"1638703693","2020-06-18 10:27:38","Work Permit Fraud Boosts Hidden Workforce of Illegal Professionals","http://feedproxy.google.com/~r/breitbart/~3/AXWrsX4vOTo/","en","False","","19334","Breitbart","http://www.breitbart.com"
"1639179284","2020-06-19 05:00:23","Businesses Brace for Possible Limits on Foreign Worker Visas","https://www.nytimes.com/2020/06/19/us/foreign-worker-visas-trump-coronavirus.html","en","False","","1","New York Times","http://nytimes.com"
"1639234246","2020-06-19 05:55:04","State fair upheaval, sewage testing, new mask rules: News from around our 50 states","http://rssfeeds.usatoday.com/~/628065122/0/usatoday-newstopstories~State-fair-upheaval-sewage-testing-new-mask-rules-News-from-around-our-states/","en","False","","4","USA Today","http://www.usatoday.com"
"1640340299","2020-06-20 12:20:55","'I always feel like I'm not at home': Life for Dreamers who returned to Mexico hasn't been easy but has its rewards","http://rssfeeds.azcentral.com/~/628175914/0/phoenix/politics~I-always-feel-like-Im-not-at-home-Life-for-Dreamers-who-returned-to-Mexico-hasnt-been-easy-but-has-its-rewards/","en","False","","25128","AZCentral","http://www.azcentral.com"
"1641483470","2020-06-22 07:00:12","Suspending work permits for foreign graduates would be a terrible mistake for US economy","http://rssfeeds.azcentral.com/~/628351074/0/phoenix/nation~Suspending-work-permits-for-foreign-graduates-would-be-a-terrible-mistake-for-US-economy/","en","False","","25128","AZCentral","http://www.azcentral.com"
"1641670826","2020-06-22 07:00:12","Suspending work permits for foreign graduates would be a terrible mistake for US economy","http://rssfeeds.usatoday.com/~/628351074/0/usatoday-newstopstories~Suspending-work-permits-for-foreign-graduates-would-be-a-terrible-mistake-for-US-economy/","en","False","","4","USA Today","http://www.usatoday.com"
"1641903260","2020-06-22 15:51:56","Trump to sign order expanding immigration restrictions to include H-1B, other guest worker programs","https://www.foxnews.com/politics/trump-order-expanding-immigration-restrictions","en","False","","1092","Fox News","http://www.foxnews.com/"
"1641936376","2020-06-22 16:11:45","Trump to announce new visa restrictions on immigrant workers but exempt agriculture, food service, health","https://www.latimes.com/politics/story/2020-06-22/trump-visa-restrictions-immigrant-workers","en","False","","6","LA Times","http://www.latimes.com/"
"1641962184","2020-06-22 17:14:35","Trump administration extends visa ban to non-immigrants","https://www.sfgate.com/news/article/Trump-administration-extends-visa-ban-to-15357874.php","en","True","","14","SF Chronicle","http://www.sfgate.com/"
"1641972695","2020-06-22 17:15:39","Trump administration extends visa ban to non-immigrants","https://www.mercurynews.com/2020/06/22/trump-administration-extends-visa-ban-to-non-immigrants/","en","True","","35","San Jose Mercury News","http://www.mercurynews.com/"
"1641974177","2020-06-22 16:34:50","Trump administration extends visa ban to non-immigrants","https://www.dispatch.com/ZZ/news/20200622/trump-administration-extends-visa-ban-to-non-immigrants?rssfeed=true","en","True","","41","Columbus Dispatch","http://www.dispatch.com/"
"1641973862","2020-06-22 16:34:50","Trump administration extends visa ban to non-immigrants","https://www.providencejournal.com/ZZ/news/20200622/trump-administration-extends-visa-ban-to-non-immigrants?rssfeed=true","en","True","","68874","providencejournal.com","http://www.providencejournal.com/#spider"
"1641995481","2020-06-22 18:03:31","Trump administration extends visa ban to non-immigrants","https://www.denverpost.com/2020/06/22/trump-administration-extends-visa-ban-to-non-immigrants/","en","False","","390346","Latest news, sports, weather from Denver and Colorado | The Denver Post","http://feeds.denverpost.com/dp-news-breaking"
"1642055353","2020-06-22 20:08:19","President Trump expands immigration restrictions, extends freezes until end of the year","https://www.theblaze.com/news/ready-president-trump-expands-immigration-restrictions-extends-freezes-until-end-of-the-year","en","False","","22088","Blaze","http://www.theblaze.com"
"1642061940","2020-06-22 20:36:59","Live Global Coronavirus News","https://www.nytimes.com/2020/06/22/world/coronavirus-updates.html","en","False","","1","New York Times","http://nytimes.com"
"1642065737","2020-06-22 20:28:46","Trump executive order extends a ban on employment-based visas through 2020","https://www.theguardian.com/us-news/2020/jun/22/trump-visas-us-immigration-tech-companies","en","False","","1751","Guardian US","https://www.theguardian.com/us"
"1642083148","2020-06-22 20:28:46","Trump executive order extends a ban on employment-based visas through 2020","https://www.theguardian.com/us-news/2020/jun/22/trump-visas-us-immigration-tech-companies","en","False","","623382","Guardian","http://www.theguardian.com/us"
"1642086516","2020-06-22 21:08:00","Trump signs executive order to temporarily block entry of H1-B foreign workers","https://www.zdnet.com/article/trump-signs-executive-order-to-temporarily-block-entry-of-h1-b-foreign-workers/#ftag=RSSbaffb68","en","False","","39330","zdnet","http://news.zdnet.com/"
"1642308872","2020-06-23 03:17:22","Trump orders halt on several work visas, cites job-loss rate","http://www.arkansasonline.com/news/2020/jun/23/trump-orders-halt-on-several-work-visas-cites-job/","en","False","","56","Arkansas Democrat-Gazette ","http://www2.arkansasonline.com/"
"1642355814","2020-06-23 05:16:30","Trump Deportations Helped Spread COVID 'Disaster' to Central America","https://www.thedailybeast.com/trump-deportations-helped-spread-covid-disaster-to-central-america?source=articles&via=rss","en","False","","1707","Daily Beast","http://www.thedailybeast.com/"
"1642493666","2020-06-23 07:10:33","Who will be hardest hit by Trump’s suspension of foreign worker visas?","https://fortune.com/2020/06/23/trump-h1b-visa-executive-order-india/","en","False","","1105","Fortune ","http://fortune.com"
"1642707235","2020-06-23 11:48:44","The hidden health cost of Trump's visa freeze","http://rss.cnn.com/~r/rss/cnn_latest/~3/eT3M4kGvKrA/index.html","en","False","","20088","CNN U.S. Edition","http://us.cnn.com"
"1642714141","2020-06-23 11:48:44","The hidden health cost of Trump's visa freeze","http://rss.cnn.com/~r/rss/cnn_latest/~3/eT3M4kGvKrA/index.html","en","False","","1095","CNN","http://www.cnn.com/"
"1642781552","2020-06-23 12:51:39","Trump’s new restrictions on foreign workers, explained","https://www.washingtonpost.com/immigration/trump-visa-restrictions-explained/2020/06/23/78c25baa-b53b-11ea-9b0f-c797548c1154_story.html?utm_source=rss&utm_medium=referral&utm_campaign=wp_business","en","False","","2","Washington Post","http://washingtonpost.com"
"1642787588","2020-06-23 13:14:50","Immigrants Sent Scrambling Amid Fallout Of New Trump Order","https://www.forbes.com/sites/andyjsemotiuk/2020/06/23/immigrants-sent-scrambling-amid-fallout-of-new-trump-order/","en","False","","1104","Forbes","http://www.forbes.com/"
"1642944753","2020-06-23 16:40:00","Trump just froze work visas during a time when a record number of immigrant-founded companies are generating record amounts of revenue","http://feedproxy.google.com/~r/businessinsider/~3/JnLpXC7duf0/immigrants-have-a-huge-role-in-founding-american-startups-2019-8","en","False","","18710","Business Insider","http://www.businessinsider.com"
"1643608589","2020-06-24 09:50:00","Trump blames the coronavirus pandemic for the latest freeze on immigrant work visas. Immigration attorneys say the ban is just another step towards long-term, restrictive policies.","https://www.businessinsider.com/trumps-ban-work-visas-h1b-immigration-restrictions-attorneys-2020-6","en","False","","18710","Business Insider","http://www.businessinsider.com"
"1643888650","2020-06-24 15:14:00","Trump's Freeze On H-1B Work Visas Disproportionately Affects Indians","https://www.npr.org/sections/coronavirus-live-updates/2020/06/24/882332598/trumps-freeze-on-h-1b-work-visas-disproportionately-affects-indians?utm_medium=RSS&utm_campaign=news","en","False","","1096","NPR","http://www.npr.org/"
"1644180368","2020-06-25 00:18:17","Trump May Attempt To Force Long-Time H-1B Visa Holders Out Of U.S.","https://www.forbes.com/sites/stuartanderson/2020/06/25/trump-may-attempt-to-force-long-time-h-1b-visa-holders-out-of-us/","en","False","","1104","Forbes","http://www.forbes.com/"
"1644456689","2020-06-25 07:09:22.183992","12 Ways the Trump Administration Has Deepened Inequality","http://feedproxy.google.com/~r/time/topstories/~3/ggowztD77xQ/","en","False","","4419","Time","http://time.com"
"1644477173","2020-06-25 07:08:44","The Cybersecurity 202: Few students are getting serious cybersecurity training. That’s bad news for the U.S. workforce.","https://www.washingtonpost.com/politics/the-cybersecurity-202-few-students-are-getting-serious-cybersecurity-training-thats-bad-news-for-the-us-workforce/2020/06/25/e06a0bc0-716e-4420-9a90-e02f6d2f1aa3_story.html?utm_source=rss&utm_medium=referral&utm_campaign=wp_politics","en","False","","2","Washington Post","http://washingtonpost.com"
"1645455723","2020-06-26 07:10:44","12 Alternatives For Immigrants Blocked By Trump’s Proclamation","https://www.forbes.com/sites/andyjsemotiuk/2020/06/26/12-alternatives-for-immigrants-blocked-by-trumps-proclamation/","en","False","","1104","Forbes","http://www.forbes.com/"
"1645620798","2020-06-26 09:32:58","Ex-Google Chief Uses 'Top Tier' Immigration Claim to Stiff U.S. College Graduates","http://feedproxy.google.com/~r/breitbart/~3/9xU-l_x75Sc/","en","False","","19334","Breitbart","http://www.breitbart.com"
"1645950881","2020-06-26 21:05:20","Trump's Visa Ban Has Foreign Workers And Families Desperate For Answers","https://www.buzzfeednews.com/article/hamedaleaziz/trump-visa-ban-foreign-workers-panic","en","False","","6218","Buzzfeed","http://www.buzzfeed.com"
"1646008738","2020-06-26 19:13:33","Trump’s presidency is a symbol of the last gasp of white supremacy","https://www.alternet.org/2020/06/trumps-presidency-is-a-symbol-of-the-last-gasp-of-white-supremacy/","en","False","","56758","Alternet","https://www.alternet.org/"
"1646050632","2020-06-26 20:42:05","H-1B: Government issues first-ever official estimate of visa population in U.S.","https://www.eastbaytimes.com/2020/06/26/h-1b-government-issues-first-ever-official-estimate-of-visa-population-in-u-s/","en","False","","27512","The Insider -","http://www.ibabuzz.com/insider/"
"1646063804","2020-06-26 21:33:09","Trump’s presidency is a symbol of the last gasp of white supremacy","http://feedproxy.google.com/~r/TheRawStory/~3/w2BGsZwV9G8/","en","False","","1127","Raw Story","http://rawstory.com"
"1646593839","2020-06-27 12:20:56","Science Leaders Display Imported Lab Workers amid Jobless U.S. Graduates","http://feedproxy.google.com/~r/breitbart/~3/d9f_x1L8_xE/","en","False","","19334","Breitbart","http://www.breitbart.com"
"1646608944","2020-06-27 13:02:31","Undocumented Survivors Have Long Lived in Limbo. COVID-19 Is Making It Worse.","https://truthout.org/articles/undocumented-survivors-have-long-lived-in-limbo-covid-19-is-making-it-worse/","en","False","","22332","Truthout","http://www.truth-out.org"
"1646629542","2020-06-27 16:43:48","Forbes: Donald Trump May Cancel Fortune 500's Huge H-1B ‘Bonded Workforce’","http://feedproxy.google.com/~r/breitbart/~3/LPKF1LaPrgA/","en","False","","19334","Breitbart","http://www.breitbart.com"
"1646731252","2020-06-27 22:00:08","Coronavirus has upended many lives, but immigrant journalists on visas face a grim reality","http://www.dailykos.com/stories/1955424","en","False","","115","Daily Kos","http://www.dailykos.com"
"1647414136","2020-06-29 00:07:19","USCIS Estimates H-1B Visa Numbers But Ignores Green Card Problem","https://www.forbes.com/sites/stuartanderson/2020/06/29/uscis-estimates-h-1b-visa-numbers-but-ignores-green-card-problem/","en","False","","1104","Forbes","http://www.forbes.com/"
"1647778929","2020-06-29 09:10:35","The human cost of Trump’s guest worker ban","https://www.theverge.com/21306188/guest-worker-ban-trump-h1b-visa-immigration-stamp-entry","en","False","","107634","Verge","http://theverge.com/"
"1648274604","2020-06-29 19:23:13","Joe Biden Promises 125,000 Refugees Each Year","http://feedproxy.google.com/~r/breitbart/~3/IxJlbabHgVQ/","en","False","","19334","Breitbart","http://www.breitbart.com"
"1648274603","2020-06-29 18:12:30","Joe Biden: H-1B Foreign Workers 'Built this Country'","http://feedproxy.google.com/~r/breitbart/~3/Bab7mqMr7z0/","en","False","","19334","Breitbart","http://www.breitbart.com"
"1648450266","2020-06-30 02:34:39","Americans Are Asking How To Erase Racial Wealth Gap. A Community Development Lender May Have The Answers.","https://www.forbes.com/sites/bonniechiu/2020/06/30/americans-are-asking-how-to-erase-racial-wealth-gap-a-community-development-lender-may-have-the-answers/","en","False","","1104","Forbes","http://www.forbes.com/"
"1648893393","2020-06-30 10:06:52","A post-pandemic world is unlikely to focus on meeting need over human greed","https://theconversation.com/a-post-pandemic-world-is-unlikely-to-focus-on-meeting-need-over-human-greed-141228","en","False","","54346","Conversation","https://theconversation.com/us"
"1648927691","2020-06-30 06:36:34","Power Up: Muddled messaging and general chaos in Trump’s White House hamper coronavirus response","https://www.washingtonpost.com/politics/power-up-muddled-messaging-and-general-chaos-in-trumps-white-house-hamper-coronavirus-response/2020/06/30/2ed59cc4-b56e-44c8-8c2b-6b9c62a40138_story.html?utm_source=rss&utm_medium=referral&utm_campaign=wp_politics","en","False","","2","Washington Post","http://washingtonpost.com"
"1649248693","2020-06-30 18:41:08","Fugitive now in China sentenced in 'birth tourism' scheme","https://abcnews.go.com/US/wireStory/fugitive-now-china-sentenced-birth-tourism-scheme-71544374","en","False","","39000","ABC News","http://abcnews.go.com/"
"1649269904","2020-06-30 18:45:24","Fugitive now in China sentenced in 'birth tourism' scheme","https://www.startribune.com/fugitive-now-in-china-sentenced-in-birth-tourism-scheme/571572902/","en","False","","19","Star Tribune ","http://www.startribune.com/"
"1649268913","2020-06-30 18:40:42","Fugitive now in China sentenced in ‘birth tourism’ scheme","https://www.seattletimes.com/nation-world/nation/fugitive-now-in-china-sentenced-in-birth-tourism-scheme/?utm_source=RSS&utm_medium=Referral&utm_campaign=RSS_all","en","True","","24940","Seattle Times","http://seattletimes.com"
"1650435738","2020-07-01 23:08:11","Second Republican Loses Primary After Backing Big Tech's Green Card Giveaway","http://feedproxy.google.com/~r/breitbart/~3/ng7LpDgskGU/","en","False","","19334","Breitbart","http://www.breitbart.com"
"1651026868","2020-07-02 12:51:26","Visa lottery winners feel cheated by Trump’s visa ban","https://www.washingtonpost.com/world/middle_east/visa-lottery-winners-feel-cheated-by-trumps-visa-ban/2020/07/02/448622fe-bc84-11ea-97c1-6cf116ffe26c_story.html?utm_source=rss&utm_medium=referral&utm_campaign=wp_world","en","False","","2","Washington Post","http://washingtonpost.com"
"1651050180","2020-07-02 12:48:41","Visa lottery winners feel cheated by Trump's visa ban","https://www.newsday.com/news/region-state/visa-lottery-winners-feel-cheated-by-trump-s-visa-ban-1.46308782","en","True","","13","Newsday","http://www.newsday.com/"
"1651246054","2020-07-02 06:00:00","‘People of color’ are protesting. Here’s what you need to know about this new identity.","https://www.washingtonpost.com/politics/2020/07/02/people-color-are-protesting-heres-what-you-need-know-about-this-new-identity/","en","False","","2","Washington Post","http://washingtonpost.com"
"1651320718","2020-07-02 21:23:44","Large majority of Americans say U.S. is a mess","https://www.aol.com/article/news/2020/07/02/new-yahoo-newsyougov-july-4-poll-a-staggering-62-percent-of-americans-no-longer-see-america-as-ronald-reagans-shining-city-on-a-hill/24544132/","en","False","","150985","AOL News","http://news.aol.com/"
"1651457876","2020-06-15 00:00:00","How Refugee Doctors Are Helping the U.S. Fight COVID-19 Even Without a Medical License","https://time.com/5848349/refugee-doctors/?utm_source=twitter&utm_medium=social&utm_campaign=editorial&utm_term=u.s._covid-19&linkId=90723324","en","False","","4419","Time","http://time.com"
"1651520175","2020-06-29 00:00:00","Many Americans didn't receive a stimulus check because of who they married","https://www.cbsnews.com/news/second-stimulus-check-marriage-first-check/","en","False","","1752","CBS News","http://www.cbsnews.com/"
"1651547133","2020-06-22 00:00:00","Tech giants blast Trump executive order suspending H-1B visas","https://www.cnet.com/news/tech-giants-blast-trump-executive-order-suspending-h-1b-visas/","en","False","","4415","CNET","http://cnet.com"
"1651760346","2020-07-03 07:00:00","The Pandemic’s Boomerang Generation Has Settled In","http://feedproxy.google.com/~r/theatlantic/TZRn/~3/Doh9RyS26Nc/","en","False","","1110","Atlantic","http://www.theatlantic.com/"
"1651890737","2020-06-22 00:00:00","Trump administration extends visa ban to non-immigrants - The Boston Globe","https://www.bostonglobe.com/2020/06/22/nation/trump-administration-extends-visa-ban-non-immigrants/","en","False","","15","The Boston Globe","https://www.bostonglobe.com/"
"1652022018","2020-06-15 00:00:00","12 Ways the Trump Administration Has Deepened Inequality","https://time.com/5859209/donald-trump-administration-inequality/","en","False","","4419","Time","http://time.com"
"1652159402","2020-07-03 12:10:09","Lawsuit: CEOs Invite India's Caste Culture into U.S. Workplaces","http://feedproxy.google.com/~r/breitbart/~3/Oxd9lxZYbUo/","en","False","","19334","Breitbart","http://www.breitbart.com"
"1652608244","2020-07-04 06:00:00","Va. Republicans to choose nominee to face Rep. Spanberger in Trump district","https://www.washingtonpost.com/local/virginia-politics/virginia-7th-gop/2020/07/03/d98242aa-bb1e-11ea-8cf5-9c1b8d7f84c6_story.html?utm_source=rss&utm_medium=referral&utm_campaign=wp_politics","en","False","","2","Washington Post","http://washingtonpost.com"
"1652795479","2020-07-04 09:21:39","‘I belong here’: Newly minted citizens share their stories","https://www.gazettenet.com/Carmen-Wallace-speaks-about-her-experience-becoming-a-naturalized-American-citizen-34972798","en","False","","26140","gazettenet.com","http://www.gazettenet.com"
"1653357237","2020-07-05 09:00:00","Some wealthy parents are eager to give their children multicultural experiences, from elaborate trips to nannies that speak multiple languages. During COVID-19, they've had to get creative.","https://www.businessinsider.com/wealthy-parents-give-kids-multicultural-experiences-trips-nannies-2020-7","en","False","","18710","Business Insider","http://www.businessinsider.com"
"1653618615","2020-07-05 16:22:21","Massachusetts moves forward reopening; RI students scramble","https://www.sfgate.com/news/article/Massachusetts-moves-forward-reopening-RI-15387253.php","en","False","","14","SF Chronicle","http://www.sfgate.com/"
"1653705113","2020-07-05 12:00:00","Defund Facial Recognition","http://feedproxy.google.com/~r/TheAtlantic/~3/L150fUArXWw/","en","False","","1110","Atlantic","http://www.theatlantic.com/"
"1653763833","2020-07-05 15:09:24","Labor Dept. Promises to Help U.S. Workers, Draft H-1B Curbs","http://feedproxy.google.com/~r/breitbart/~3/uu5LCkPumRk/","en","False","","19334","Breitbart","http://www.breitbart.com"
"1654566091","2020-07-06 17:27:00","U.S. says foreign students may have to leave if their school goes online-only","https://www.nbcnews.com/politics/immigration/ice-tells-foreign-students-leave-u-s-if-their-school-n1233026","en","False","","34663","NBC Breaking News","http://www.breakingnews.com#spider"
"1654604625","2020-07-06 18:38:26","ICE to foreign students: If you&#8217;re just taking online classes, you can&#8217;t stay in the U.S.","http://feeds.mashable.com/~r/Mashable/~3/CEAGuGOM-LA/","en","False","","5527","Mashable!","http://mashable.com"
"1654649608","2020-07-06 20:05:26","ICE launches new ‘needlessly cruel’ rules against international students in the US","https://www.alternet.org/2020/07/ice-launches-new-needlessly-cruel-rules-against-international-students-in-the-us/","en","False","","56758","Alternet","https://www.alternet.org/"
"1654668026","2020-07-06 19:55:00","ICE Threatens International Students With 'Immigration Consequences' if Schools Go Online-Only","https://gizmodo.com/ice-threatens-international-students-with-immigration-c-1844286028","en","False","","4469","Gizmodo","http://gizmodo.com"
"1654673689","2020-07-06 20:55:06","ICE says international students taking online courses have to transfer or leave the US, as dozens of schools shift to remote learning in response to COVID-19","http://feedproxy.google.com/~r/businessinsider/~3/x7uMQEl35T4/international-students-visas-cant-take-only-online-classes-ice-2020-7","en","False","","18710","Business Insider","http://www.businessinsider.com"
"1654736895","2020-07-06 23:06:23","ICE: International students must leave US if universities only offer online classes this fall","http://rssfeeds.azcentral.com/~/629664243/0/phoenix/nation~ICE-International-students-must-leave-US-if-universities-only-offer-online-classes-this-fall/","en","False","","25128","AZCentral","http://www.azcentral.com"
"1654737514","2020-07-06 22:30:17","Trade Group for Koch, GM Asks Trump for More Foreign Workers","http://feedproxy.google.com/~r/breitbart/~3/cOCYwfqYjcc/","en","False","","19334","Breitbart","http://www.breitbart.com"
"1654785958","2020-07-07 00:21:18","ICE: International students must leave US if universities only offer online classes this fall","http://rssfeeds.usatoday.com/~/629664243/0/usatoday-newstopstories~ICE-International-students-must-leave-US-if-universities-only-offer-online-classes-this-fall/","en","False","","4","USA Today","http://www.usatoday.com"
"1655276190","2020-07-07 08:11:49","ICE to Deny Foreign Student Visas for Colleges Teaching Online This Fall","https://slate.com/news-and-politics/2020/07/ice-foreign-international-student-visas-deny-online-college-university.html?via=rss","en","False","","19643","Slate.com","http://www.slate.com"
"1655292023","2020-07-07 11:17:30","New rules for international students could cost U.S. colleges $41 billion","https://www.cnbc.com/2020/07/07/new-rules-for-international-students-could-cost-us-colleges-billions.html","en","False","","1755","CNBC","http://www.cnbc.com/"
